{
  "$schema": "./feature.schema.json",
  "slug": "gantt",
  "title": "RevoGantt",
  "summary": "Editable project timelines with dependencies, working calendars, resources, baselines, task editing, and critical-path analysis.",
  "edition": "Pro Advanced",
  "repositoryUrl": "https://github.com/revolist/gantt",
  "productUrl": "https://rv-grid.com/gantt/",
  "trialUrl": "https://pro.rv-grid.com/guides/installation-npm-trial/",
  "pricingUrl": "https://rv-grid.com/pricing/",
  "liveDemoUrl": "https://gantt.rv-grid.com/",
  "frameworks": ["ts", "react", "vue", "angular"],
  "examples": [
    {
      "id": "showcase",
      "title": "Project planning showcase",
      "summary": "Editable project planning with resources, baselines, and critical-path controls.",
      "query": "example=showcase",
      "default": true
    },
    {
      "id": "big-data",
      "title": "10,000-task performance",
      "summary": "Virtualized editing and 19,796 dependencies across a three-month project.",
      "query": "example=big-data"
    },
    {
      "id": "horizontal-big-data",
      "title": "Twenty-year timeline performance",
      "summary": "Responsive horizontal navigation, zooming, editing, and 194 dependencies across twenty years.",
      "query": "example=horizontal-big-data"
    },
    {
      "id": "benchmark",
      "title": "Reproducible browser benchmark",
      "summary": "Measured Gantt rendering, navigation, editing, scheduling, hierarchy, memory, and DOM across twelve deterministic project shapes.",
      "query": "example=benchmark"
    }
  ],
  "recipes": [
    { "id": "dependencies-calendars", "title": "Dependencies and calendars", "summary": "Model linked tasks against explicit working calendars and holidays.", "path": "recipes/dependencies-calendars.ts" },
    { "id": "resources-baselines", "title": "Resources and baselines", "summary": "Add assignments, capacity, costs, and an approved comparison snapshot.", "path": "recipes/resources-baselines.ts" },
    { "id": "critical-path-editing", "title": "Critical path and task editing", "summary": "Enable schedule-risk visuals and the production task editing workflow.", "path": "recipes/critical-path-editing.ts" }
  ],
  "media": {
    "poster": "assets/gantt-walkthrough-poster.webp",
    "walkthroughGif": "assets/gantt-walkthrough.gif",
    "walkthroughMp4": "assets/gantt-walkthrough.mp4",
    "screenshots": ["assets/screenshots/overview.webp", "assets/screenshots/workflow.webp", "assets/screenshots/details.webp", "assets/screenshots/result.webp"]
  },
  "demoOutput": "dist"
}
